{
  "$defs": {
    "IssueStatus": {
      "enum": [
        "open",
        "closed"
      ],
      "type": "string"
    }
  },
  "$schema": "https://json-schema.org/draft/2020-12/schema",
  "additionalProperties": false,
  "description": "An issue: `issues/<n>.json` (structure) + `issues/<n>.md` (authored body).",
  "properties": {
    "body": {
      "default": "",
      "description": "The issue's authored prose: everything below the frontmatter, verbatim.\n\nCarried whole and never parsed. An issue's headings are its author's, not\na template's, so there are no fields for a parse to land in -- and\nparsing into nothing is how prose becomes a drop that no surface reports.\n\n**No normalisation at all**, including the blank line the format puts\nbetween the frontmatter and the first heading. Rendering the frontmatter\nand then this reproduces the file byte for byte, which is what makes the\nround trip lossless without anything having to compensate for it.",
      "type": "string"
    },
    "closed": {
      "description": "When it was closed, if it is closed.",
      "type": [
        "string",
        "null"
      ]
    },
    "created": {
      "type": "string"
    },
    "number": {
      "description": "Rendered zero-padded, eg `0021`.",
      "format": "uint32",
      "minimum": 0,
      "type": "integer"
    },
    "reporter": {
      "description": "Who reported it, free text, exactly as recorded.",
      "type": [
        "string",
        "null"
      ]
    },
    "schema": {
      "description": "Always [`ISSUE_SCHEMA`].",
      "type": "string"
    },
    "severity": {
      "description": "**STORED AS A STRING, AND VALIDATED AT THE DOOR BY [`IssueSeverity`].**\n\nThe permitted set is a closed roster, so the obvious move is a typed enum\nhere -- and it is the wrong one. A typed field makes DESERIALISATION\nstrict, so an issue already carrying an out-of-roster value stops being\nreadable, which converts a cosmetic defect into an unreadable store on\nsomebody else's machine. **Refusing a bad value on the way IN while still\nreading whatever is already there is the asymmetry that fixes this\nwithout a migration.** Measured 2026-08-27 across six estates on this\nmachine: 165 issues, every value in roster, none to migrate -- and that\nmeasurement covers this machine only, which is exactly why the read stays\npermissive.",
      "type": [
        "string",
        "null"
      ]
    },
    "slug": {
      "type": "string"
    },
    "status": {
      "$ref": "#/$defs/IssueStatus"
    },
    "title": {
      "type": "string"
    }
  },
  "required": [
    "schema",
    "number",
    "slug",
    "title",
    "status",
    "created"
  ],
  "title": "Issue",
  "type": "object",
  "x-intent-ver": "3.2.8",
  "x-schema-json-ver": 24
}
