{
  "schema": "intent/issue@3.0",
  "number": 9,
  "slug": "intent-agents-sync-answers-what-languages-by",
  "title": "intent agents sync answers 'what languages?' by filesystem probe while the rest of Intent reads the declared languages array",
  "status": "closed",
  "severity": "low",
  "created": "2026-07-29",
  "reporter": "matts"
}
