{
  "schema": "intent/issue@3.0",
  "number": 249,
  "slug": "implemented-check-sh-derives-and-double-guards-t",
  "title": "implemented_check.sh derives and double-guards the needle it owns while hardcoding five clap strings it does not, and one of those five is already dead",
  "status": "closed",
  "severity": "medium",
  "created": "2026-09-04",
  "closed": "2026-09-11",
  "reporter": "Matthew Sinclair",
  "body": "**`implemented_check.sh` DERIVES AND DOUBLE-GUARDS THE ONE NEEDLE IT OWNS, AND HARDCODES THE FIVE IT DOES NOT.** The unguarded five come from clap -- a third-party crate this project does not control -- and they gate the bucket that separates *never reached dispatch* from *answered*. **A needle that stops matching produces a false IMPLEMENTED, silently, in the reassuring direction.**\n\n## The asymmetry, in the file's own terms\n\n**THE MARKER IS OWNED, DERIVED, AND GUARDED TWICE:**\n\n    :92   MARKER=\"$(sed -n 's/.*\\(is a known command...\\).*/\\1/p' \"$RENDER_RS\" ...)\"\n    :93   [ -n \"$MARKER\" ] || die \"could not derive the unimplemented marker ... would otherwise report every row implemented\"\n    :343  [ \"$UNIMPL\" -gt 0 ] || die \"no row matched ... Check which before trusting a green\"\n\nIts header states the reasoning: *THE NEEDLE IS DERIVED, NOT WRITTEN DOWN, and its absence REFUSES. A hardcoded marker that stops matching turns this whole script green and silent.*\n\n**THE CLAP NEEDLES ARE NOT OWNED, ARE HARDCODED, AND ARE GUARDED BY NOTHING:**\n\n    :230  UNREACHED_NEEDLES='were not provided\n                             requires a subcommand\n                             unrecognized subcommand\n                             invalid value\n                             unexpected argument'\n    :315  (the only other reference -- consumed, never checked)\n\n**The script applies its own stated discipline to the string it controls and not to the strings a dependency upgrade can reword.** Those are the ones most likely to change, and clap's wording is not covered by any test in this estate.\n\n## ONE OF THE FIVE IS ALREADY DEAD\n\n**`invalid value` is UNREACHABLE on this surface**, because Intent validates its own enums before clap's message can fire. Driven:\n\n    intent issues list --kind bogus      -> error: `bogus` is not an issue bucket   (Intent's, not clap's)\n    intent issues add x --severity bogus -> no needle matched\n    intent critic bogus                  -> no needle matched\n    intent issues list --format bogus    -> no needle matched\n\n**Nothing in the script notices.** The other four DO still match, driven with argv passed as argv: `claude hook` -> *were not provided*; `st` -> *requires a subcommand*; `st frobnicate` -> *unrecognized subcommand*; `claude skills install --nope` -> *unexpected argument*.\n\n## WHY THE FAILURE IS INVISIBLE RATHER THAN MERELY POSSIBLE\n\n**The current sweep reports `0 never reached dispatch`.** That is the DESIRED state -- the script supplies declared placeholders precisely so rows reach dispatch -- **and it is also exactly what a totally dead needle set would print.** The bucket cannot distinguish *every row reached dispatch* from *the classifier can no longer recognise a row that did not*.\n\n**So the marker's zero-match guard has no counterpart here, and it cannot simply be copied:** refusing on an empty UNREACHED bucket would refuse on the healthy state. **The instrument is blind in the one direction where blindness and success look identical.**\n\n## THE FAILURE PATH, STATED PRECISELY\n\nA row clap turns away emits **no marker** -- `unwired()` lives at the dispatch match and is never reached. If its refusal text also fails to match a needle, the row falls to the default branch and is counted as **ANSWERED**, i.e. implemented. **The over-count is the exact defect this file was built to fix**, recorded in its own comment: `claude hook` was invisible until placeholders were supplied, and *a check that cannot see its own motivating case is a decoration*.\n\n## REMEDY SHAPE, NOT PRESCRIBED\n\nThe file already owns the right pattern -- its B1/B2 mutation arms prove *exit 2 alone does not classify, and the marker alone does*. **The same shape applied here is a POSITIVE CONTROL rather than a zero-match refusal: drive a known clap refusal through the classifier on every run and assert it lands in UNREACHED.** That distinguishes a healthy empty bucket from a dead needle set, which no count can. Dropping `invalid value`, or deriving the needles from clap rather than transcribing them, are separate choices this issue does not pre-empt.\n\n## NOT CLAIMED\n\n**No false positive is asserted in the current output.** Four of five needles match live clap output today, and the 101-of-116 figure is not challenged. **What is claimed is that the instrument has no way to tell you when that stops being true**, and that one needle has already crossed that line unnoticed.\n"
}
