{
  "schema": "intent/issue@3.0",
  "number": 623,
  "slug": "releasing-md-says-two-screenshot-runs-over-an-un",
  "title": "releasing.md says two screenshot runs over an unchanged explorer are byte-identical, but runs on different days differ by the demo seed's created date",
  "status": "closed",
  "severity": "low",
  "created": "2026-10-22",
  "closed": "2026-10-23",
  "reporter": "Matthew Sinclair",
  "body": "## What\n\n`intent/docs/releasing.md` step 2 says \"Two runs over an unchanged explorer write byte-identical files, so a clean status means the page still shows what ships.\" That holds only within one day. ic measured this on 2026-10-22 at the 3.2.5 cut's screenshot pass:\n\n- `gen_explorer_shots.sh` ran on the pair at 8bef2bb7a (pyte 0.8.2), writing all 11 shots into scratch. 9 were byte-identical to `docs/images/explorer`. `edit.png` and `thread.png` differed, at the same 1758x1092 size.\n- In both, the only change above a 5% difference threshold is one 31x22 px region (x 425..455, y 415..436). It is the demo thread's \"created\" field: 2026-10-16 in the committed shots, taken at the 3.2.4 cut-prep pass (ef9889423), against 2026-10-22. The rest of `edit.png`'s changed pixels are below 5%, which is the 64-colour palette reduction shifting.\n- The cause is that the tool seeds its demo projects fresh under `/tmp/intent-demo` on every run, and the seeded thread is created on the day of the run. The tool elides the version and commit the explorer draws, but not dates.\n\nSo at every cut taken on a new day, two shots change while the explorer has not, and a clean `git status -- docs/images/explorer` cannot be the cut's test. At this cut the shots stay as committed, on vc's word.\n\n## Expected\n\nThe tool pins the seed's date, so two runs over an unchanged explorer are byte-identical on any day and a clean status is the cut's test again. Not measured: whether the seed can set a thread's created date through a verb a reader could type. Failing that, `releasing.md` names the seed's date as the one expected difference.\n\nFound by ic at the 3.2.5 cut's screenshot pass. Filed by ic on vc's word.\n\n## Spec (vc, 2026-10-23, under hv's go)\n\nLANE: ic, M, riding decision 70(3): the screenshot generator is rewritten as a Rust dev tool in the workspace on the `vt100` crate, and the Python generator, its pyte requirement and releasing.md's `--python` line go with it. SHAPE: the rewritten generator pins the demo seed's date, so two runs over an unchanged explorer are byte-identical on any day. First measure whether a thread's created date is settable through a verb a reader could type (`intent set <ST> created`, as `completed` is since 0503 and 0504): if it is, the seed sets a fixed date; if it is not, the generator says so and releasing.md step 2 names the seed's date as the one expected difference, and this record says which. PROOF: a run on the pinned seed shows the pinned date in `edit.png` and `thread.png`'s created field, and `git status -- docs/images/explorer` is clean after a run over an unchanged explorer; the positive control is a deliberate explorer change, which makes it dirty. CLOSES WHEN: the generator's bank is judged and landed, the shots are regenerated from it once, and `intent issues close 0623` names the sha.\n\nCLOSED 2026-10-23. Fixed by 6bd64b1c8 (refs/bank/ic/0623/fix-b.patch, patch-id d25b350d3bfd, landed on vc's word): the screenshots are taken by `native/rust/crates/intent-cli/examples/explorer_shots.rs`, a Rust example of intent-cli on the `vt100` crate, and the Python generator, its pyte requirement and releasing.md's `--python` line are gone, as decision 70(3) asked. THE MEASUREMENT THE SPEC ASKED FOR: a thread's created date is not settable through any verb. `intent set ST0085 created 2026-10-16` on the 3.2.5 pair exits 1 with \"`created` cannot be set on `intent:///threads/ST0085`: this is a machine stamp: the service layer writes it once, from the clock, at the moment of the event, and nothing moves it afterwards. There is no verb for this and there should not be\". hv chose the pin at render in ic's TUI on 2026-10-23, so the generator reads the dates the seed can stamp, in UTC and local time, on both sides of seeding and draws each as 2026-10-16, the date the committed shots carried, and releasing.md names no expected difference. PROOF: from a build of 108f05fa0 with the bank, the shots were byte-identical to docs/images/explorer on 10 of 11, edit.png and thread.png included. help.png differed only in its counter, 1/102 against 1/103, because the root help gained `guards` at 3c2ed2d39, and that explorer change is the positive control: it made `git status -- docs/images/explorer` dirty. The shots were refreshed once, at f2ece5503, by the generator run in main with the pair `bin/devbin build all` promoted at c59e80779, which carries this fix, 0624, 0627 and 0614. help.png's counter moved from 1/102 to 1/103, one 14x22 px glyph cell and nothing else, and every other shot was byte-identical to what was committed."
}
