{
  "schema": "intent/issue@3.0",
  "number": 219,
  "slug": "in-ag-pfic-001-has-six-canon-set-homes-stating-a",
  "title": "IN-AG-PFIC-001 has six canon-set homes stating a different rule, and in-review checks the wrong one",
  "status": "closed",
  "severity": "high",
  "created": "2026-09-02",
  "closed": "2026-09-02",
  "reporter": "Matthew Sinclair",
  "body": "**`IN-AG-PFIC-001` MEANS ONE THING IN THE RULE THAT OWNS IT AND A DIFFERENT THING IN SIX CANON-SET HOMES, AND ONE OF THE SIX IS AN ENFORCEMENT CHECKLIST THAT THEREFORE REPORTS THE RULE ENFORCED WHEN IT WAS NEVER EXAMINED.**\n\nFOUND 2026-09-02 by ic reading `AC-00.8` (ST0065). Corroborated the same evening by vc from their own live session context.\n\n## THE TWO READINGS\n\n**OWNER** -- `intent/plugins/claude/rules/agnostic/pfic/RULE.md`: title *Pure Function, Impure Coordination*. An ARCHITECTURAL rule: keep the domain core deterministic and side-effect-free; push I/O, time, randomness and external calls out to the boundary; coordinators compose pure functions and handle the effects.\n\n**THE SIX HOMES**: *Pure-Functional-Idiomatic-Coordination; pattern match, pipe, tag, compose.* A STYLE rule about functional idiom.\n\n**THESE ARE NOT TWO WORDINGS OF ONE RULE. THEY ARE TWO RULES.** Code can satisfy the second completely -- pattern-matched, piped, tagged, composed -- while violating the first outright, because idiom says nothing about where the I/O lives.\n\n## THE SIX HOMES, AND WHY THREE OF THEM ARE MORE THAN UNTIDINESS\n\n1. `intent/plugins/claude/skills/in-review/SKILL.md:54` -- **THE LIVE DEFECT.** The review checklist reads `IN-AG-PFIC-001 -- pattern-match, pipe, tagged-tuple, compose idioms in play`. **A reviewer checks idiom, finds it, and records this rule as CHECKED while I/O sits three calls deep in a domain core.** An instrument that reports a rule enforced when it was never examined -- the vacuous-instrument class, in the estate's own review path.\n2. `lib/templates/llm/_AGENTS.md:191` -- **THE FLEET TEMPLATE.** Every Intent project receives the fork at init and inherits it on every `agents sync`.\n3. `intent/plugins/claude/rules/lua/code/dispatch-table-over-if-chain/RULE.md:177` -- **INSIDE THE RULE LIBRARY.** A Lua rule glosses the agnostic principle it cites with the wrong expansion, so the library contradicts its own agnostic pack.\n4. `intent/plugins/claude/skills/in-standards/SKILL.md:27` -- the skill whose job is loading these four principles. **vc confirmed this is what loaded into their session at boot tonight, so every node working this project all evening has been holding the wrong rule.**\n5. `AGENTS.md:131` (this project, generated from home 2).\n6. `intent/plugins/agents/templates/_default/RULES.md:10` -- laid down at fresh init.\n\nAlso present, non-canon and not part of this issue: `intent/llm/RULES.md:10` and a v2 blog draft.\n\n## DIVERGENCE AT BIRTH, NOT DRIFT -- CHECKED RATHER THAN ASSUMED\n\n`RULE.md` has carried *Pure Function, Impure Coordination* since its creating commit `1743fa88` (ST0034 WP04) and **has never been renamed**. The two readings were never in agreement at any point. **So this cannot be dismissed as drift somebody will fix in passing, and no copy of this rule has ever once been correct in this estate.**\n\n## WHY NOTHING CAUGHT IT\n\n`AT-00.1` compares canon documents against rule SUMMARIES for a 12-word verbatim span. **This fork shares almost no words with the summary it contradicts, and four of its six homes are skills and templates, which are not in that instrument's population at all.** The paraphrase half of `AC-00.1` is therefore not only the judgement half -- **it is also the half with the larger population**, which is why the split into `AC-00.8` was not bookkeeping.\n\n## RULED REMEDY (vc, 2026-09-02, under hv's pen)\n\n**THE FIX IS THE POINTER, NOT A BETTER COPY.** The six homes cite `IN-AG-PFIC-001` and stop restating it -- `AC-00.1`'s own mechanism, and the reason that row exists. **A corrected copy is a copy that will be right until the first time nobody remembers it**, and this one was wrong from its creating commit.\n\n**ORDER, BY BLAST RADIUS RATHER THAN EFFORT:**\n1. `in-review/SKILL.md` -- it produces false verdicts today.\n2. `lib/templates/llm/_AGENTS.md` -- the fleet inherits the fork.\n3. The rule library's own cross-reference -- a library contradicting its agnostic pack undermines every rule in it.\n\n**NOT YET EXECUTED.** Raised to hv, because the fix changes what a rule MEANS across the fleet template and the rule library, and ic had already routed that call to hv before vc ruled the shape.\n\n=== FIXED 2026-09-02, `311ca65c` (ic). hv RULED IT RIDES IN v3.0.1, FIRST-HAND IN SESSION ===\n\n**All six homes now name the rule and point at `intent claude rules show IN-AG-PFIC-001` instead of stating what it requires.** Fixed in the ruled blast-radius order: `in-review/SKILL.md`, `lib/templates/llm/_AGENTS.md`, the lua cross-reference, `in-standards/SKILL.md`, `_default/RULES.md`, `intent/llm/RULES.md`, and `AGENTS.md` regenerated from the template.\n\n**THE STEP THAT ACTUALLY ENDED IT WAS `intent claude skills sync`, NOT THE COMMIT.** A commit to canon leaves every node loading the old text out of `~/.claude/skills/`, which is `AC-00.5`'s stranding mechanism arriving inside the fix for `AC-00.1`. Driven after the sync rather than taken from its report: the INSTALLED `in-standards/SKILL.md` and `in-review/SKILL.md` both carry the corrected line.\n\n**THE FORM CHOSEN, AND THE BOUNDARY IT RESTS ON:** each site carries the rule's TITLE plus the read verb, not a bare id. A bare id in a review checklist gives a reviewer nothing to recognise and would trade one unusable artefact for another. **The boundary is that naming a rule is not restating it -- the fork here was never the name, it was a name PLUS a content gloss (*pattern match, pipe, tag, compose*).** Ratified by vc on the fix.\n\n**THE RESIDUAL, RECORDED RATHER THAN ASSUMED AWAY (vc): A TITLE IS STILL A COPY, SO IT CAN FORK ON A RENAME.** If `IN-AG-PFIC-001` is ever retitled, these six sites go stale in exactly the way the six glosses did -- the same mechanism at a smaller surface. **The trade is deliberate: a title is one short phrase that a rename would obviously invalidate, where a content gloss can diverge in MEANING while every word still reads plausibly, which is what let this one survive from `1743fa88` to today unnoticed.** The exposure is bounded and named; it is not eliminated.\n\n**AND IT IS RECORDED HERE RATHER THAN AT ALL SIX SITES ON PURPOSE.** A caveat repeated into six documents is the defect this issue is about, performed on itself.\n\n**THE OTHER THREE PRINCIPLES ARE DELIBERATELY UNTOUCHED.** Highlander, Thin Coordinator and No Silent Errors are restatements too, and they AGREE with their owners. **A restatement that agrees is a LATENT fork; one that disagrees is a LIVE defect.** Only the second was ruled, and treating them alike would have been the tidy answer rather than the correct one.\n"
}
