{
  "schema": "intent/issue@3.0",
  "number": 646,
  "slug": "intent-app-s-menu-shows-the-raw-version-line-in",
  "title": "Intent.app's menu shows the raw version line in its masthead and its Open item lands on a token refusal: the parser predates ST0087's line and the item opens the page without the token",
  "status": "closed",
  "severity": "high",
  "created": "2026-10-25",
  "closed": "2026-10-25",
  "reporter": "Matthew Sinclair",
  "body": "Reported by hv on 2026-10-25 (typed into utilz-ic's window, relayed verbatim by utilz-ic to vc and ic) from two screenshots of the installed Intent.app 3.2.6 (the dev build installed to /Applications on 2026-10-24 16:23) and the pair at 397d7568e; filed by vc, in 3.2.7 and ahead of the other interface work because it is in hv's face.\n\n## What happens\n\n1. Intent.app's menu top row reads `Intent intent 3.2.6 (dev, 397d7568e1d8) at /Users/matts/Devel/prj/Intent dev` with no second line. hv: \"What on _earth_ is going in here? What is all of that crap in the top row?\" and \"There was a _clear_ instruction about how to use arca_swift's masthead. Whatever that monstrosity is, it's not using arca_swift's masthead like the other menubar apps.\" and, of ` at /Users/matts/Devel/prj/Intent dev`: \"Who asked for that? It certainly wasn't me.\"\n2. The intentd flyout's Open item opens http://127.0.0.1:51737/estate/status, which shows a red box `this request carried no valid token` over web.rs's Bearer-token text and nothing else. hv: \"Also, what is this?\"\n\n## Measured (vc, ic and utilz-ic, 2026-10-25)\n\n- `native/macos/Intent/Intent/Masthead/masthead.yaml` uses arca_swift's ArcaMasthead as Gtools' and menuz's do: `heading: \"{name} {version}\"`, `subheading: \"{commit} · {kind}\"`. The row is right; its input is wrong. `VersionService.parse` (Services/VersionService.swift near line 91) still matches the pre-ST0087 line `intent <version> (<commit>) <kind>`; ST0087 WP-01 (976fad577, in the pair since 14:09Z) changed the line to `intent <version> (<tree>, <sha12>[+dirty]) at <root> <provenance>`, the match fails, and the parser's fallback returns the whole line as `{version}` with commit and kind nil, so the heading shows the raw line and the subheading collapses. The design recorded this reader and moved it to WP-03's Swift half; vc accepted the gap on 2026-10-25 as \"the dev Intent.app shows the degraded masthead between the build all and ic's landing\", which hv has now rejected by looking at it.\n- The ` at <root>` and trailing `dev` are the contract's T4 line (devbin docs/dev-opt-brew.md v0.4, agreed by the four estates' nodes as SAME on 2026-10-24, not ruled by hv in those words); the same line is live in Utilz and devbin. The app was never meant to show them: masthead.yaml shows version, commit and kind only.\n- The page's data call is `/op`, which requires `Authorization: Bearer <token>`; `intent estate status --browser` opens the page with the token in the URL fragment, which shell.html reads and stores; the app's Open item opens the bare URL, so every fetch is refused and the page shows the refusal as its content. Opening the bare URL in a browser by hand meets the same.\n\n## The fix, specified (vc, 2026-10-25)\n\n(a) `VersionService.parse` reads the contract's line: version, tree, sha12 (shown as the first eight), optional `+dirty`, root, optional provenance word, and still the old shapes; the masthead shows `Intent 3.2.6` over `397d7568 · dev` exactly as masthead.yaml says and as menuz's row reads; the root is parsed and never shown. This is the parser already written in ST0087 WP-03's Swift draft, split out as its own bank with its four arms (AT-03.4), so it lands before the rest of WP-03. Its judge is `bin/devbin macos app-test` (IntentTests) plus the swift critic; the arms cover the new line, its +dirty form, the brew form and the `(dev, unknown)` form.\n(b) The intentd flyout's Open item runs the one URL builder instead of opening a bare URL: it execs `intent estate status --browser` through the `intent` it already resolves, so the token travels in the fragment exactly as from the command line and there is one implementation of how the page is opened. An arm drives the item's command.\n(c) shell.html's no-token state is a sentence, not a refusal dump: it says the page is opened with `intent estate status --browser` (or Intent.app's Open) because its data needs the daemon's token, and shows no Bearer text; an arm in intentd's tests asserts the page's text with no token present.\n(d) After the landing, ic builds the app and installs it to /Applications by the route of 2026-10-24's build, relaunches it, and tells hv; the dev app then shows the row as every other menubar app does. The CLI's own line is not changed by this issue: whether `intent --version` keeps ` at <root>` and the provenance word is a contract question vc has put to hv separately.\n\nOwner: ic, now, ahead of ST0088's judge at molt-vc's desk. XS to S.\n"
}
